slug,title,primary_keyword,category,intent,tools,summary
best-n8n-workflows-for-lead-routing,Best n8n Workflows for Lead Routing,best n8n workflows for lead routing,n8n workflows,workflow template research,n8n|digital-first-ai|reclaim-ai,Compare lead capture routing enrichment calendar handoff and follow-up automations for small teams.
n8n-vs-zapier-for-ai-agents,n8n vs Zapier for AI Agents,n8n vs zapier ai agents,n8n alternatives,commercial investigation,n8n|digital-first-ai,Explain when n8n is better for stateful AI automations and when simpler app automation is enough.
openclaw-alternatives-for-business-automation,OpenClaw Alternatives for Business Automation,OpenClaw alternatives,OpenClaw alternatives,alternative research,openclaw|n8n|digital-first-ai|reclaim-ai,Capture OpenClaw comparison traffic and route non-developers toward managed automation tools.
openclaw-vs-n8n,OpenClaw vs n8n: Which Should Operators Use?,OpenClaw vs n8n,OpenClaw alternatives,comparison,openclaw|n8n,Position OpenClaw for agent runtime experiments and n8n for operational workflow deployment.
best-restaurant-ai-phone-agents,Best Restaurant AI Phone Agents,best restaurant AI phone agent,restaurant AI tools,buyer comparison,ringfoods|maple,Compare recurring restaurant phone agent offers around missed calls reservations orders and POS handoff.
ringfoods-vs-maple,RingFoods vs Maple for Restaurant Calls,RingFoods vs Maple,restaurant AI tools,comparison,ringfoods|maple,Direct comparison for restaurants and consultants choosing an AI phone answering system.
best-ai-tools-for-restaurant-menus,Best AI Tools for Restaurant Menus,best AI tools for restaurant menus,restaurant AI tools,buyer comparison,shevafood|foodshot-ai|ringfoods,Combine QR menus AI food images and phone ordering for menu modernization search intent.
restaurant-ai-tools-for-small-business,Restaurant AI Tools for Small Business,restaurant AI tools small business,restaurant AI tools,buyer guide,ringfoods|maple|shevafood|foodshot-ai,Practical stack for independent restaurants that need phone coverage menu updates and better listing assets.
