channel,theme,post
linkedin,n8n workflows,"Most teams do not need a bigger AI model first. They need a reliable workflow: intake, enrichment, routing, calendar handoff, and a human fallback. I mapped the n8n workflow stack I would use for that here: ./site/comparisons/best-n8n-workflows-for-lead-routing.html"
linkedin,OpenClaw alternatives,"OpenClaw is interesting for technical agent experiments, but most operators asking about it need something deployable this week. I built the plain-English comparison against n8n and adjacent automation tools: ./site/comparisons/openclaw-vs-n8n.html"
linkedin,restaurant AI,"Restaurant AI has a brutally simple ROI story: missed calls, slow reservations, order mistakes, and staff interruptions. I compared the phone-agent options I would evaluate first: ./site/comparisons/best-restaurant-ai-phone-agents.html"
threads,n8n workflows,"New comparison live: n8n workflows for lead routing. Intake, enrichment, scheduling, and follow-up without turning every handoff into spreadsheet glue."
threads,restaurant AI,"Restaurant AI tools worth watching: phone agents for missed calls, QR menu software, and AI food photos. The practical stack is smaller than the hype."
bluesky,OpenClaw alternatives,"OpenClaw vs n8n is really agent runtime vs workflow operations. I wrote the operator-focused comparison for people choosing what to deploy."
linkedin,paid diagnostic,"I opened a small number of same-day AI Workflow Revenue Diagnostics. The deliverable is practical: one workflow or funnel, prioritized failure points, and an implementation map for n8n, OpenClaw-style agents, affiliate tracking, or restaurant AI tools. Checkout: https://buy.stripe.com/4gMcN562o9Lo05reOD3sI11"
threads,paid diagnostic,"Same-day offer: AI Workflow Revenue Diagnostic. One funnel/workflow, one fix list, one implementation map. Built for n8n, affiliate funnels, OpenClaw-style agents, and restaurant AI stacks. https://buy.stripe.com/4gMcN562o9Lo05reOD3sI11"
bluesky,paid diagnostic,"I put up a $499 AI Workflow Revenue Diagnostic for operators who need a concrete automation/funnel fix list instead of another AI tools brainstorm: https://buy.stripe.com/4gMcN562o9Lo05reOD3sI11"
threads,qsr pack,"QSR operators: I opened a $197 OpenClaw/n8n agent pack for missed-call capture, ordering handoff, inventory reorder watchlists, loyalty winback, and daily manager ops digests. https://ai-seo-operator-stack.web.app/offers/qsr-openclaw-agent-pack.html"
bluesky,qsr pack,"New QSR operator pack: missed-call capture, order handoff, inventory watchlist, loyalty winback, manager digest. Built for restaurants, food trucks, caterers, and restaurant-tech consultants. https://ai-seo-operator-stack.web.app/offers/qsr-openclaw-agent-pack.html"
